id,title,authors,year,topic,source,path,selection,selection_reason
P1_ai in real life,"Opportunistic Identification of Vertebral Compression Fractures on CT Scans of the Chest and Abdomen, Using an AI Algorithm, in a Real-Life Setting","M. Bendtsen, M. Hitz",2024,ai in real life,Semantic Scholar,papers/ai in real life_260126_161715/ai in real life_paper_1.pdf,yes,Open-access PDF available
P2_ai in real life,Science Fiction to Real Life: Bing AI as An Investment Advisor,"İnci Merve Altan, Metin Kiliç",2023,ai in real life,Semantic Scholar,papers/ai in real life_260126_161715/ai in real life_paper_2.pdf,yes,Open-access PDF available
P1_dog,"Genome sequence, comparative analysis and haplotype structure of the domestic dog","K. Lindblad-Toh, C. Wade, T. Mikkelsen, E. Karlsson, D. Jaffe, Michael Kamal, M. Clamp, Jean L. Chang, E. Kulbokas, M. Zody, E. Mauceli, Xiaohui Xie, M. Breen, R. Wayne, E. Ostrander, C. Ponting, F. Galibert, Douglas R. Smith, P. Dejong, E. Kirkness, P. Alvarez, T. Biagi, W. Brockman, Jonathan Butler, Chee-Wye Chin, A. Cook, James A. Cuff, M. Daly, David DeCaprio, S. Gnerre, M. Grabherr, Manolis Kellis, M. Kleber, C. Bardeleben, L. Goodstadt, A. Heger, C. Hitte, L. Kim, Klaus‐Peter Koepfli, H. Parker, J. Pollinger, S. Searle, N. Sutter, Rachael Thomas, C. Webber, E. Lander",2005,dog,Semantic Scholar,papers/dog_260207_084250/dog_paper_1.pdf,yes,Open-access PDF available
P1_computer vision,Rethinking the Inception Architecture for Computer Vision,"Christian Szegedy, Vincent Vanhoucke, Sergey Ioffe, Jonathon Shlens, Z. Wojna",2015,computer vision,Semantic Scholar,papers/computer vision_260207_084415/computer vision_paper_1.pdf,yes,Open-access PDF available
P2_computer vision,Attention mechanisms in computer vision: A survey,"Meng-Hao Guo, Tianhan Xu, Jiangjiang Liu, Zheng-Ning Liu, Peng-Tao Jiang, Tai-Jiang Mu, Song-Hai Zhang, Ralph Robert Martin, Ming-Ming Cheng, Shimin Hu",2021,computer vision,Semantic Scholar,papers/computer vision_260207_084415/computer vision_paper_2.pdf,yes,Open-access PDF available
P1_machine learning,Physics-informed machine learning,"G. Karniadakis, I. Kevrekidis, Lu Lu, P. Perdikaris, Sifan Wang, Liu Yang",2021,machine learning,Semantic Scholar,papers/machine learning_260207_085659/machine learning_paper_1.pdf,yes,Open-access PDF available
P2_machine learning,"Machine Learning: Algorithms, Real-World Applications and Research Directions",Iqbal H. Sarker,2021,machine learning,Semantic Scholar,papers/machine learning_260207_085659/machine learning_paper_2.pdf,yes,Open-access PDF available
P3_machine learning,A Survey on Bias and Fairness in Machine Learning,"Ninareh Mehrabi, Fred Morstatter, N. Saxena, Kristina Lerman, A. Galstyan",2019,machine learning,Semantic Scholar,papers/machine learning_260207_085659/machine learning_paper_3.pdf,yes,Open-access PDF available
